,Title,Year,Released,Runtime,Genre,Director,Writer,Actors,Plot,Language,Country,Awards,Metascore,imdbRating,imdbVotes,imdbID,BoxOffice
446,Mr. Turner,2014,31-Oct-14,150 min,"Biography, Drama, History",Mike Leigh,Mike Leigh,"Timothy Spall, Paul Jesson, Dorothy Atkinson","Mr. Turner explores the last quarter century of the great if eccentric British painter J.M.W. Turner (1775-1851). Profoundly affected by the death of his father, loved by a housekeeper he takes for granted and occasionally exploits sexually, he forms a close relationship with a seaside landlady with whom he eventually lives incognito in Chelsea, where he dies. Throughout this, he travels, paints, stays with the country aristocracy, visits brothels, is a popular if anarchic member of the Royal Academy of Arts, has himself strapped to the mast of a ship so that he can paint a snowstorm, and is both celebrated and reviled by the public and by royalty.",English,"United Kingdom, France, Germany, United States, Belgium",Nominated for 4 Oscars. 20 wins & 71 nominations total,94,6.8,"27,131",tt2473794,"$3,958,500 "
447,Mrs. Harris Goes to Paris,2022,15-Jul-22,115 min,"Comedy, Drama",Anthony Fabian,"Paul Gallico, Carroll Cartwright, Anthony Fabian","Lesley Manville, Isabelle Huppert, Lambert Wilson","In partnership with the House of Dior, Mrs. Harris Goes To Paris tells the story of a widowed cleaning lady in 1950s London who falls madly in love with a couture Dior dress, and decides that she must have one of her own. After she works, starves and gambles to raise the funds to pursue her dream, she embarks on an adventure to Paris which will change not only her own outlook, but the very future of the House of Dior.","English, French","United Kingdom, Canada, France, Hungary, Belgium",Nominated for 1 Oscar. 4 wins & 13 nominations total,70,7.1,"25,781",tt5151570,"$10,433,915 "
448,Mudbound,2017,17-Nov-17,134 min,"Drama, War",Dee Rees,"Virgil Williams, Dee Rees, Hillary Jordan","Jason Mitchell, Carey Mulligan, Jason Clarke","In the aftermath of WWII, somewhere in the muddy Mississippi Delta, two families--one black, the Jacksons, and the other white, the McAllans--are forced to share the same patch of land, keeping a frail race-based peace with each other. However, as they both struggle with hardship and dire poverty, the long-awaited return of two war veterans--Ronsel, the Jacksons' eldest son, and Jamie, Henry McAllan's younger brother--will unexpectedly nurture a budding friendship that transcends prejudice and race. But, in the end, against a backdrop of fevered Mississippi sunsets and vitriolic racism, life can be hard when the law of the land is still segregation and hatred. And then, no one can be safe.",English,United States,Nominated for 4 Oscars. 36 wins & 117 nominations total,85,7.4,"54,189",tt2396589,N/A
449,Mulan,2020,4-Sep-20,115 min,"Action, Adventure, Drama",Niki Caro,"Rick Jaffa, Amanda Silver, Lauren Hynek","Liu Yifei, Donnie Yen, Gong Li","To keep her ailing father from serving in the Imperial Army, a fearless young woman disguises herself as a man and battles northern invaders in China.","English, Mandarin","United States, China",Nominated for 2 Oscars. 10 wins & 42 nominations total,66,5.8,"158,286",tt4566758,N/A
450,Music by Prudence,2010,12-May-10,33 min,"Documentary, Short, Biography",Roger Ross Williams,N/A,"Farai Mabhande, Prudence Mabhena, Energy Maburutse","Prudence Mabhena leads a group of young, disabled Africans who inspire others with their music, proving that disability does not mean inability.",English,"United States, Zimbabwe",Won 1 Oscar. 1 win & 1 nomination total,N/A,7.2,163,tt1543539,N/A
451,Mustang,2015,17-Jun-15,97 min,Drama,Deniz Gamze Ergüven,"Deniz Gamze Ergüven, Alice Winocour","Günes Sensoy, Doga Zeynep Doguslu, Tugba Sunguroglu","Early summer. In a village in northern Turkey, Lale and her four sisters are walking home from school, playing innocently with some boys. The immorality of their play sets off a scandal that has unexpected consequences. The family home is progressively transformed into a prison; instruction in homemaking replaces school and marriages start being arranged. The five sisters who share a common passion for freedom, find ways of getting around the constraints imposed on them.",Turkish,"France, Germany, Turkey, Qatar",Nominated for 1 Oscar. 46 wins & 63 nominations total,83,7.6,"40,826",tt3966404,"$845,464 "
452,My Life as a Zucchini,2016,24-Feb-17,70 min,"Animation, Comedy, Drama",Claude Barras,"Céline Sciamma, Claude Barras, Morgan Navarro","Gaspard Schlatter, Sixtine Murat, Paulin Jaccoud","Courgette (Zucchini) is an intriguing nickname for a 9-year-old boy. Although his unique story is surprisingly universal. After his mother's disappearance, Courgette is befriended by a police officer Raymond, who accompanies him to his new foster home filled with other orphans his age. At first he struggles to find his place in this strange, at times, hostile environment. Yet with Raymond's help and his new-found friends, Courgette eventually learns to trust and might find true love.",French,"Switzerland, France",Nominated for 1 Oscar. 24 wins & 22 nominations total,85,7.8,"28,965",tt2321405,"$309,766 "
453,My Nephew Emmett,2017,7-May-17,20 min,"Short, Drama, History",Kevin Wilson Jr.,Kevin Wilson Jr.,"L.B. Williams, Joshua Wright, Dane Rhodes","At 2:30AM on August 28, 1955 in the most racially divided state in the country, 64 year-old Mose Wright tries to protect his 14 year-old nephew Emmett Till from two racist killers out for blood. Based on the true story of the 1955 murder of Emmett Louis Till.",English,United States,Nominated for 1 Oscar. 6 wins & 1 nomination total,N/A,6.8,747,tt6598290,N/A
454,My Octopus Teacher,2020,7-Sep-20,85 min,"Documentary, Drama","Pippa Ehrlich, James Reed","Pippa Ehrlich, James Reed","Craig Foster, Tom Foster","After years of swimming every day in the freezing ocean at the tip of Africa, Craig Foster meets an unlikely teacher a young octopus who displays remarkable curiosity. Visiting her den and tracking her movements for months on end he eventually wins the animal's trust and they develop a never before seen bond between human and wild animal.",English,South Africa,Won 1 Oscar. 11 wins & 15 nominations total,82,8.1,"63,516",tt12888462,N/A
455,My Week with Marilyn,2011,23-Dec-11,99 min,"Biography, Drama",Simon Curtis,"Adrian Hodges, Colin Clark","Michelle Williams, Eddie Redmayne, Kenneth Branagh","Sir Laurence Olivier (Sir Kenneth Branagh) is making a movie in London. Young Colin Clark (Eddie Redmayne), an eager film student, wants to be involved and he navigates himself a job on the set. When movie star Marilyn Monroe (Michelle Williams) arrives for the start of shooting, all of London is excited to see the blonde bombshell, while Olivier is struggling to meet her many demands and acting ineptness, and Colin is intrigued by her. Colin's intrigue is met when Marilyn invites him into her inner world where she struggles with her fame, her beauty, and her desire to be a great actress.","English, French","United Kingdom, United States",Nominated for 2 Oscars. 18 wins & 64 nominations total,65,6.9,"89,412",tt1655420,"$14,600,347 "
456,My Year of Dicks,2022,17-Feb-23,24 min,"Animation, Short, Comedy",Sara Gunnarsdóttir,Pamela Ribon,"Brie Tilton, Jackson Kelly, Klarissa Hernandez","Pam tries very hard to lose her virginity and always searches for ""the one."" She's not alone; her best friends are with her.",English,"United States, Iceland",Nominated for 1 Oscar. 8 wins & 7 nominations total,N/A,7.1,"2,933",tt17663790,N/A
457,Na Wewe,2010,11-Feb-11,19 min,"Short, Drama, War",Ivan Goldschmidt,"Ivan Goldschmidt, Jean-Luc Pening","Fabrice Kwizera, Renaud Rutten","1994 or thereabouts. There is a civil war on in Burundi. A genocidal conflict opposing Hutus and Tutsis... We are witnesses to one of those sadly frequent episodes : the attack by the rebels of a minibus transporting ordinary passengers. A Kalashnikov bursts out. The bus stops, the passengers get off. There follows a «selection» separating Hutus and Tutsis. But who is a Hutu, who is a Tutsi? Na Wewe means You Too in Kirundi.",French,Belgium,Nominated for 1 Oscar. 1 win & 1 nomination total,N/A,6.9,343,tt1764508,N/A
458,Napoleon,2023,22-Nov-23,158 min,"Action, Adventure, Biography",Ridley Scott,David Scarpa,"Joaquin Phoenix, Vanessa Kirby, Tahar Rahim","An epic that details the chequered rise and fall of French Emperor Napoleon Bonaparte and his relentless journey to power through the prism of his addictive, volatile relationship with his wife, Josephine.","English, French, Russian, German, Italian","United States, United Kingdom",Nominated for 3 Oscars. 4 wins & 38 nominations total,N/A,6.4,"127,028",tt13287846,"$61,524,375 "
459,Navalny,2022,11-Apr-22,99 min,"Documentary, Biography",Daniel Roher,N/A,"Alexei Navalny, Yulia Navalnaya, Christo Grozev",Follows the man who survived an assassination attempt by poisoning with a lethal nerve agent in August 2020. During his months-long recovery he makes shocking discoveries about the attempt on his life and decides to return home.,"English, Russian, German",United States,Won 1 Oscar. 17 wins & 32 nominations total,82,7.7,"29,089",tt17041964,N/A
460,Nebraska,2013,24-Jan-14,115 min,Drama,Alexander Payne,Bob Nelson,"Bruce Dern, Will Forte, June Squibb","""NEBRASKA"" is a father-and-son road trip, from Billings, Montana to Lincoln, Nebraska that gets waylaid at a small town in central Nebraska, where the father grew up and has scores to settle. Told with deadpan humor and a unique visual style, it's ultimately the story of a son trying to get through to a father he doesn't understand.","English, Spanish",United States,Nominated for 6 Oscars. 29 wins & 169 nominations total,86,7.7,"123,155",tt1821549,"$17,654,912 "
461,Nefta Football Club,2018,11-Mar-19,17 min,"Short, Comedy, Drama",Yves Piat,Yves Piat,"Eltayef Dhaoui, Mohamed Ali Ayari, Lyès Salem","In a Tunisian village, children are playing football on a wasteland. Meanwhile, Abdallah and Mohammed come across a donkey with headphones on his ears and bags full of a white powder on his back. The two young brothers decide to bring those bags back to their village.",Arabic,"France, Tunisia, Algeria",Nominated for 1 Oscar. 24 wins & 13 nominations total,N/A,7.2,"2,036",tt8551848,"$330,661 "
462,Negative Space,2017,13-Jun-17,5 min,"Animation, Short, Drama","Ru Kuwahata, Max Porter","Max Porter, Ru Kuwahata, Ron Koertge",Albert Birney,"After years of practice, Sam is now an expert in packing. Meticulous, and with an eye for detail, Sam transforms this mundane but challenging process to a ritual and a true form of art, as the finite space of a suitcase can magically offer so many different combinations, otherwise unseen to the untrained eye. But, it is this unusual knack for taking advantage of the bag's nooks and crannies that binds him with his father, along with the vibrant memories of childhood, and the bittersweet taste of a silent but ardent affection. How much love can one cram in the negative space of recollection?",English,France,Nominated for 1 Oscar. 11 wins & 8 nominations total,N/A,7.4,"2,544",tt7090150,N/A
463,Never Look Away,2018,3-Oct-18,189 min,"Biography, Drama, Romance",Florian Henckel von Donnersmarck,Florian Henckel von Donnersmarck,"Tom Schilling, Sebastian Koch, Paula Beer","Young artist Kurt Barnert (Tom Schilling) has fled to West Germany but continues to be tormented by the experiences of his childhood and youth in the Nazi years and during the GDR-regime. When he meets student Ellie (Paula Beer), he is convinced that he has met the love of his life and starts to create paintings that mirror not only his own fate, but also the traumas of an entire generation.","German, Russian","Germany, Italy",Nominated for 2 Oscars. 5 wins & 18 nominations total,68,7.7,"25,253",tt5311542,"$1,304,042 "
464,New Boy,2007,27-Feb-09,11 min,"Short, Drama",Steph Green,"Roddy Doyle, Steph Green","Olutunji Ebun-Cole, Simon O'Driscoll, Fionn O'Shea","It's the first day of school in Ireland for Joseph, an African lad of about ten or 12. The teacher introduces him to the class, he sits, and as the day progresses he remembers moments of his schooling back home. Two of the boys in class start to tease and pick on him; he's stoic, ignoring them at first. He's defended by one of the girls in class. Recess approaches and one of the lads tells Joseph to watch out. How will the confrontation play out?",English,Ireland,Nominated for 1 Oscar. 15 wins & 1 nomination total,N/A,7.1,"1,193",tt1095191,N/A
465,News of the World,2020,25-Dec-20,118 min,"Action, Adventure, Drama",Paul Greengrass,"Paul Greengrass, Luke Davies, Paulette Jiles","Tom Hanks, Helena Zengel, Tom Astor","Five years after the end of the Civil War, Captain Jefferson Kyle Kidd (Tom Hanks), a veteran of three wars, now moves from town to town as a non-fiction storyteller, sharing the news of presidents and queens, glorious feuds, devastating catastrophes, and gripping adventures from the far reaches of the globe. On the plains of Texas, he crosses paths with Johanna (Helena Zengel), a 10-year-old taken in by the Kiowa people six years earlier and raised as one of their own. Johanna, hostile to a world she's never experienced, is being returned to her biological aunt and uncle against her will. Kidd agrees to deliver the child where the law says she belongs. As they travel hundreds of miles into the unforgiving wilderness, the two will face tremendous challenges of both human and natural forces as they search for a place that either can call home.","English, North American Indian, German","United States, China",Nominated for 4 Oscars. 5 wins & 80 nominations total,73,6.8,"95,327",tt6878306,"$12,668,325 "
466,Nattrikken,2020,12-Jun-20,15 min,"Short, Drama",Eirik Tveiten,Eirik Tveiten,"Sigrid Kandal Husjord, Ola Hoemsnes Sandum, Axel Barø Aasen","A cold night in December. Ebba waits for the tram to go home after a party, but the ride takes an unexpected turn.",Norwegian,Norway,Nominated for 1 Oscar. 3 wins & 1 nomination total,N/A,6.4,"1,567",tt12566792,N/A
467,Nightcrawler,2014,31-Oct-14,117 min,"Crime, Drama, Thriller",Dan Gilroy,Dan Gilroy,"Jake Gyllenhaal, Rene Russo, Bill Paxton","NIGHTCRAWLER is a thriller set in the nocturnal underbelly of contemporary Los Angeles. Jake Gyllenhaal stars as Lou Bloom, a driven young man desperate for work who discovers the high-speed world of L.A. crime journalism. Finding a group of freelance camera crews who film crashes, fires, murder and other mayhem, Lou muscles into the cut-throat, dangerous realm of nightcrawling - where each police siren wail equals a possible windfall and victims are converted into dollars and cents. Aided by Rene Russo as Nina, a veteran of the blood-sport that is local TV news, Lou blurs the line between observer and participant to become the star of his own story.",English,United States,Nominated for 1 Oscar. 44 wins & 126 nominations total,76,7.8,"601,545",tt2872718,"$32,381,217 "
468,Nightmare Alley,2021,17-Dec-21,150 min,"Crime, Drama, Thriller",Guillermo del Toro,"Guillermo del Toro, Kim Morgan, William Lindsay Gresham","Bradley Cooper, Cate Blanchett, Toni Collette","Stan burns down his home and takes a job as a carny with a traveling carnival. Stan is disturbed at how any man could sink to the level of performing as a geek. Clem explains that he seeks out alcoholic or drug-addicted men with troubled pasts, and lures them in with promises of a ""temporary"" job and opium-laced alcohol. He then uses their dependence until they sink into madness and depravity, thus creating a new geek. Stan also works with clairvoyant act ""Madame Zeena"" and her alcoholic husband, Pete. He and Zeena warn Stan not to ever use these skills otherwise people get hurt. Meanwhile Stan becomes attracted to fellow performer Molly and approaches her with an idea for a two-person act away from the carnival.","English, French","United States, Mexico, Canada",Nominated for 4 Oscars. 30 wins & 121 nominations total,70,7,"164,185",tt7740496,"$11,338,107 "
469,Nimona,2023,30-Jun-23,101 min,"Animation, Action, Adventure","Nick Bruno, Troy Quane","Robert L. Baird, Lloyd Taylor, Pamela Ribon","Chloë Grace Moretz, Riz Ahmed, Eugene Lee Yang","When a knight in a futuristic medieval world is framed for a crime he didn't commit, the only one who can help him prove his innocence is Nimona -- a mischievous teen who happens to be a shapeshifting creature he's sworn to destroy.",English,"United States, Japan, Australia",Nominated for 1 Oscar. 3 wins & 41 nominations total,75,7.5,"46,340",tt19500164,N/A
470,Nine,2009,25-Dec-09,118 min,"Drama, Musical, Romance",Rob Marshall,"Michael Tolkin, Anthony Minghella, Arthur Kopit","Daniel Day-Lewis, Marion Cotillard, Penélope Cruz","Arrogant, self-centered movie director Guido Contini (Daniel Day-Lewis) finds himself struggling to find meaning, purpose, and a script for his latest movie endeavor. With only a week left before shooting begins, he desperately searches for answers and inspiration from his wife, his mistress, his muse, and his mother. As his chaotic profession steadily destroys his personal life, Guido must find a balance between creating art and succumbing to its obsessive demands.","English, Italian, French","United Kingdom, United States",Nominated for 4 Oscars. 8 wins & 60 nominations total,49,5.8,"45,189",tt0875034,"$19,676,965 "
471,Ninety-Five Senses,2023,25-Jan-24,13 min,"Animation, Short, Drama","Jared Hess, Jerusha Hess","Chris Bowman, Hubbel Palmer",Tim Blake Nelson,An ode to the body's five senses delivered by a man with little time left to enjoy them.,English,United States,Nominated for 1 Oscar. 14 wins & 17 nominations total,N/A,N/A,499,tt11020596,N/A
472,No,2012,9-Aug-12,118 min,"Drama, History",Pablo Larraín,"Pedro Peirano, Antonio Skármeta","Gael García Bernal, Alfredo Castro, Antonia Zegers",An advertising executive comes up with a campaign to defeat Augusto Pinochet in Chile's 1988 referendum.,Spanish,"Chile, France, Mexico, United States",Nominated for 1 Oscar. 13 wins & 21 nominations total,81,7.4,"26,170",tt2059255,"$2,343,664 "
473,No Time to Die,2021,8-Oct-21,163 min,"Action, Adventure, Thriller",Cary Joji Fukunaga,"Neal Purvis, Robert Wade, Cary Joji Fukunaga","Daniel Craig, Ana de Armas, Rami Malek","Bond has left active service and is enjoying a tranquil life in Jamaica. His peace is short-lived when his old friend Felix Leiter from the CIA turns up asking for help. The mission to rescue a kidnapped scientist turns out to be far more treacherous than expected, leading Bond onto the trail of a mysterious villain armed with dangerous new technology.","English, French, Italian, Russian, Spanish, Norwegian, German","United Kingdom, United States",Won 1 Oscar. 44 wins & 76 nominations total,68,7.3,"443,390",tt2382320,"$160,891,007 "
474,Nocturnal Animals,2016,9-Dec-16,116 min,"Drama, Thriller",Tom Ford,"Tom Ford, Austin Wright","Amy Adams, Jake Gyllenhaal, Michael Shannon","A ""story inside a story,"" in which the first part follows a woman named Susan who receives a book manuscript from her ex-husband, a man she left 20 years earlier, asking for her opinion. The second element follows the actual manuscript, called ""Nocturnal Animals,"" which revolves around a man whose family vacation turns violent and deadly. It also continues to follow the story of Susan, who finds herself recalling her first marriage and confronting some dark truths about herself.",English,"United States, China",Nominated for 1 Oscar. 21 wins & 153 nominations total,67,7.5,"302,981",tt4550098,"$10,663,357 "
475,Nomadland,2020,19-Feb-21,107 min,Drama,Chloé Zhao,"Chloé Zhao, Jessica Bruder","Frances McDormand, David Strathairn, Linda May","Following the economic collapse of a company town in rural Nevada, Fern (Frances McDormand) packs her van and sets off on the road exploring a life outside of conventional society as a modern-day nomad. The third feature film from director Chloé Zhao, NOMADLAND features real nomads Linda May, Swankie and Bob Wells as Fern's mentors and comrades in her exploration through the vast landscape of the American West.",English,United States,Won 3 Oscars. 254 wins & 153 nominations total,91,7.3,"181,875",tt9770150,"$3,700,000 "
476,Nyad,2023,3-Nov-23,121 min,"Biography, Drama, Sport","Jimmy Chin, Elizabeth Chai Vasarhelyi","Julia Cox, Diana Nyad","Annette Bening, Jodie Foster, Anne Marie Kempf","The remarkable true story of athlete Diana Nyad who, at the age of 60 and with the help of her best friend and coach, commits to achieving her life-long dream: a 110-mile open ocean swim from Cuba to Florida.","English, Spanish",United States,Nominated for 2 Oscars. 9 wins & 37 nominations total,N/A,7.1,"34,318",tt5302918,N/A
477,Nai Nai & Wài Pó,2023,12-Mar-23,17 min,"Documentary, Short, Comedy",Sean Wang,N/A,"Yi Yan Fuei, Zhang Li Hua","A personal love letter from director Sean Wang to his Nai Nai and Wài Pó, a grandma super team that dances, stretches, and farts their sorrows away.",Mandarin,United States,Nominated for 1 Oscar. 5 wins & 6 nominations total,N/A,7.7,64,tt26218316,N/A
478,O.J.: Made in America,2016,20-May-16,467 min,"Documentary, Biography, Crime",Ezra Edelman,N/A,"Kareem Abdul-Jabbar, Mike Albanese, Muhammad Ali","A chronicle of the rise and fall of O.J. Simpson, whose high-profile murder trial exposed the extent of American racial tensions, revealing a fractured and divided nation.",English,United States,Won 1 Oscar. 49 wins & 35 nominations total,N/A,8.9,"21,318",tt5275892,N/A
479,Of Fathers and Sons,2017,16-Nov-18,99 min,"Documentary, War",Talal Derki,"Talal Derki, Abd-Elhamed Emad Taha","Tia Alkerdi, Yara Ibrahim, Abu Osama","Talal Derki returns to his homeland where he gains the trust of a radical Islamist family, sharing their daily life for over two years. His camera is providing an extremely rare insight into what it means to grow up in an Islamic Caliphate.",Arabic,"Germany, United States, Syria, Lebanon, Netherlands, Qatar",Nominated for 1 Oscar. 25 wins & 22 nominations total,70,7.3,"2,699",tt7519174,"$12,579 "
480,Oktapodi,2007,7-Oct-15,3 min,"Animation, Short, Comedy","Julien Bocabeille, François-Xavier Chanioux, Olivier Delabarre","Julien Bocabeille, François-Xavier Chanioux, Olivier Delabarre",N/A,"The course of true love never did run smooth. Two octopi entwine in an embrace when a hand reaches from above, plucks them out of the water, disentangles them, tosses the male back in what now we see is a small aquarium, puts the female in a cold storage box, and heads for a delivery truck. He recovers from the initial shock and gives pursuit, grabbing the back of the truck as it leaves, then working himself to the front. As the driver tries to thwart his efforts to save his woman, the truck careens through the small coastal town. Will he succeed? Do other perils await?",None,France,Nominated for 1 Oscar. 6 wins & 2 nominations total,N/A,7.2,"3,511",tt1323941,N/A
481,Omar,2013,1-Aug-13,98 min,"Crime, Drama, Romance",Hany Abu-Assad,Hany Abu-Assad,"Adam Bakri, Leem Lubany, Eyad Hourani",A young Palestinian freedom fighter agrees to work as an informant after he's tricked into an admission of guilt by association in the wake of an Israeli soldier's killing.,"Arabic, Hebrew",Occupied Palestinian Territory,Nominated for 1 Oscar. 13 wins & 12 nominations total,75,7.5,"15,454",tt2852406,"$356,000 "
482,On Body and Soul,2017,2-Feb-18,116 min,"Drama, Fantasy, Mystery",Ildikó Enyedi,Ildikó Enyedi,"Alexandra Borbély, Géza Morcsányi, Réka Tenki","On the outskirts of Budapest, the ageing recluse and saturnine manager of a small abattoir, Endre, is used to hiding his disabled left arm along with his emotions behind a busy schedule. Then, unexpectedly, a shy and graceful newcomer in the office catches Endre's eye: Mária, the plant's cryptic and glacially beautiful quality-control inspector. Now, against the backdrop of the cold slaughterhouse and a small theft within the company's walls, an eerie and almost spiritual bond will start to develop between the tender outcasts, as, more and more, their lives become inextricably intertwined. However, are the two dreamers, Endre and Mária, ready to embrace the catharsis of love on both body and soul?",Hungarian,Hungary,Nominated for 1 Oscar. 19 wins & 23 nominations total,77,7.5,"29,648",tt5607714,N/A
483,On My Mind,2021,10-Jul-21,18 min,"Short, Drama",Martin Strange-Hansen,Martin Strange-Hansen,"Rasmus Hammerich, Camilla Bendix, Ole Boisen","Henrik wants to sing a song for his wife. It has to be today, it has to be now. It's a question of life, death and karaoke.",Danish,Denmark,Nominated for 1 Oscar. 12 wins & 10 nominations total,N/A,6.6,953,tt15289736,N/A
484,Once Upon a Time... in Hollywood,2019,26-Jul-19,161 min,"Comedy, Drama",Quentin Tarantino,Quentin Tarantino,"Leonardo DiCaprio, Brad Pitt, Margot Robbie","Quentin Tarantino's Once Upon a Time... in Hollywood visits 1969 Los Angeles, where everything is changing, as TV star Rick Dalton (Leonardo DiCaprio) and his longtime stunt double Cliff Booth (Brad Pitt) make their way around an industry they hardly recognize anymore. The ninth film from the writer-director features a large ensemble cast and multiple storylines in a tribute to the final moments of Hollywood's golden age.","English, Italian, Spanish, German","United States, United Kingdom, China",Won 2 Oscars. 149 wins & 380 nominations total,83,7.6,"839,528",tt7131622,"$142,502,728 "
