,Title,Year,Released,Runtime,Genre,Director,Writer,Actors,Plot,Language,Country,Awards,Metascore,imdbRating,imdbVotes,imdbID,BoxOffice
642,The Cove,2009,7-Aug-09,92 min,"Documentary, Biography, Crime",Louie Psihoyos,Mark Monroe,"Richard O'Barry, Louie Psihoyos, Hardy Jones","Richard O'Barry was the man who captured and trained the dolphins for the television show Flipper (1964). O'Barry's view of cetaceans in captivity changed from that experience when as the last straw he saw that one of the dolphins playing Flipper - her name being Kathy - basically committed suicide in his arms because of the stress of being in captivity. Since that time, he has become one of the leading advocates against cetaceans in captivity and for the preservation of cetaceans in the wild. O'Barry and filmmaker 'Louie Psihoyos (I)' go about trying to expose one of what they see as the most cruel acts against wild dolphins in the world in Taiji, Japan, where dolphins are routinely corralled, either to be sold alive to aquariums and marine parks, or slaughtered for meat. The primary secluded cove where this activity is taking place is heavily guarded. O'Barry and Psihoyos are well known as enemies by the authorities in Taiji, the authorities who will use whatever tactic to expel the two from Japan forever. O'Barry, Psihoyos and their team covertly try to film as a document of conclusive evidence this cruel behavior. They employ among others Hollywood cameramen and deep sea free divers. They also highlight what is considered the dangerous consumption of dolphin meat (due to its high concentration of mercury) which is often sold not as dolphin meat, and the Japanese government's methodical buying off of poorer third world nations for their support of Japan's whaling industry, that support most specifically at the International Whaling Commission.","English, Japanese",United States,Won 1 Oscar. 39 wins & 18 nominations total,84,8.4,"51,364",tt1313104,"$857,005 "
643,The Creator,2023,29-Sep-23,133 min,"Action, Adventure, Drama",Gareth Edwards,"Gareth Edwards, Chris Weitz","John David Washington, Madeleine Yuna Voyles, Gemma Chan","Against the backdrop of a war between humans and robots with artificial intelligence, a former soldier finds the secret weapon, a robot in the form of a young child.","English, Thai",United States,Nominated for 2 Oscars. 13 wins & 43 nominations total,N/A,6.8,"151,847",tt11858890,"$40,774,679 "
644,The Croods,2013,22-Mar-13,98 min,"Animation, Adventure, Comedy","Kirk DeMicco, Chris Sanders","Kirk DeMicco, Chris Sanders, John Cleese","Nicolas Cage, Ryan Reynolds, Emma Stone","""The Croods"" are an eccentric family of cavemen, who survive the harsh terrain by living accordingly to a strict set of rules. But when their home is destroyed in the wake of an impending disaster known as ""The End"", they are forced to leave their home of shelter and security, and into the wilderness of the unknown to find a new home.",English,United States,Nominated for 1 Oscar. 5 wins & 46 nominations total,55,7.2,"230,666",tt0481499,"$187,168,425 "
645,The Crush,2009,22-Apr-10,15 min,"Short, Comedy, Drama",Michael Creagh,Michael Creagh,"Olga Wehrly, Rory Keenan, Oran Creagh","Eight year old Ardal develops a crush on his nice teacher Miss Purdy and decides that her loutish boyfriend is not good enough for her so he challenges him to a duel. The duellists meet but,unlike his rival,Ardal has a real gun,stolen from his Garda father. The duel produces results...",English,Ireland,Nominated for 1 Oscar. 1 win & 2 nominations total,N/A,6.6,"1,688",tt1509756,N/A
646,The Curious Case of Benjamin Button,2008,25-Dec-08,166 min,"Drama, Fantasy, Romance",David Fincher,"Eric Roth, Robin Swicord, F. Scott Fitzgerald","Brad Pitt, Cate Blanchett, Tilda Swinton","On the day that Hurricane Katrina hits New Orleans, elderly Daisy Williams (nee Fuller) is on her deathbed in a New Orleans hospital. At her side is her adult daughter, Caroline. Daisy asks Caroline to read to her aloud the diary of Daisy's lifelong friend, Benjamin Button. Benjamin's diary recounts his entire extraordinary life, the primary unusual aspect of which was his aging backwards, being diagnosed with several aging diseases at birth and thus given little chance of survival, but who does survive and gets younger with time. Abandoned by his biological father, Thomas Button, after Benjamin's biological mother died in childbirth, Benjamin was raised by Queenie, a black woman and caregiver at a seniors home. Daisy's grandmother was a resident at that home, which is where she first met Benjamin. Although separated through the years, Daisy and Benjamin remain in contact throughout their lives, reconnecting in their forties when in age they finally match up. Some of the revelations in Benjamin's diary are difficult for Caroline to read, especially as it relates to the time past this reconnection between Benjamin and Daisy, when Daisy gets older and Benjamin grows younger into his childhood years.","English, Russian, French",United States,Won 3 Oscars. 85 wins & 160 nominations total,70,7.8,"693,461",tt0421715,"$127,509,326 "
647,The Dam Keeper,2014,11-Oct-14,18 min,"Animation, Short, Drama","Robert Kondo, Daisuke 'Dice' Tsutsumi","John Henry Hinkel, Robert Kondo, Daisuke 'Dice' Tsutsumi","Lars Mikkelsen, Courtney Lockwood","A young pig with an important job, and a new friend who changes everything. In a desolate future, one small town has survived because of a large windmill dam that acts as a fan to keep out pollution. The dam's operator, Pig, works tirelessly to keep the sails spinning and protect the town, despite abuse from classmates and an indifferent public. When a new student joins Pig's class, nothing will be the same again.",English,United States,Nominated for 1 Oscar. 6 wins & 4 nominations total,N/A,7.9,"2,469",tt3326262,N/A
648,The Danish Girl,2015,22-Jan-16,119 min,"Biography, Crime, Drama",Tom Hooper,"Lucinda Coxon, David Ebershoff","Eddie Redmayne, Alicia Vikander, Amber Heard","Copenhagen, Denmark, 1926. Einar Wegener (played by Eddie Redmayne) and his wife Gerda (Alicia Vikander) are a happily married couple. Both are artists, Einar preferring landscapes and she portraits. One day Einar poses for a portrait of Gerda's while wearing a dress. This is initially done as a lark, as is the later attendance at a party dressed as a woman. However, Einar soon discovers that she is in fact a woman and over time prefers being Lili. At first she and Gerda try to have her situation ""cured"" but this leads nowhere (other than to many doctors trying to have Lili locked up as a pervert and/or lunatic). Her voyage of self-discovery will ultimately lead to her undergoing the first ever sex-change operation.","English, French, German, Ukrainian","United Kingdom, United States, Germany, Denmark, Belgium, Japan",Won 1 Oscar. 31 wins & 80 nominations total,66,7.1,"198,076",tt0810819,"$11,114,018 "
649,The Dark Knight,2008,18-Jul-08,152 min,"Action, Crime, Drama",Christopher Nolan,"Jonathan Nolan, Christopher Nolan, David S. Goyer","Christian Bale, Heath Ledger, Aaron Eckhart","Set within a year after the events of Batman Begins (2005), Batman, Lieutenant James Gordon, and new District Attorney Harvey Dent successfully begin to round up the criminals that plague Gotham City, until a mysterious and sadistic criminal mastermind known only as ""The Joker"" appears in Gotham, creating a new wave of chaos. Batman's struggle against The Joker becomes deeply personal, forcing him to ""confront everything he believes"" and improve his technology to stop him. A love triangle develops between Bruce Wayne, Dent, and Rachel Dawes.","English, Mandarin","United States, United Kingdom",Won 2 Oscars. 163 wins & 164 nominations total,84,9,"2,855,919",tt0468569,"$534,987,076 "
650,The Descendants,2011,9-Dec-11,115 min,"Comedy, Drama",Alexander Payne,"Alexander Payne, Nat Faxon, Jim Rash","George Clooney, Shailene Woodley, Amara Miller","Matt King's family has lived in Hawaii for generations. His extended family - namely he and his many cousins - own 25,000 acres of undeveloped land on Kauai held in trust, which ends in seven years. The easiest thing for the family to do is sell the land before the seven years is up, which is all the talk in the state, as, to whom they sell the property could very well change the face of Kauai. Despite the vast wealth that comes with the land, Matt has decided to live solely on what he earns as a Honolulu lawyer. However, Matt has not had a perfect life living in Hawaiian paradise as many believe. He and his wife Elizabeth were having problems in their marriage. She recently got into a boating accident which has placed her in a coma. Their seventeen year old daughter Alex is in boarding school on the big island since they couldn't handle her rebellion, which was made all the worse by an argument of an unknown nature between mother and daughter during Alex's last visit home. And their ten year old daughter Scottie is starting to act out, which Matt doesn't know if he can handle, potentially raising her on his own. Matt decides to bring Alex home upon news that Elizabeth is brain dead, and that she will be pulled off life support. But revelations about Elizabeth and Alex's argument, which is tied indirectly to the issue of the land sale, leads to some decisions on Matt's part about what is best for him in both mourning Elizabeth's death and what is the best thing to do about the land, the two decisions which may be incompatible.",English,United States,Won 1 Oscar. 65 wins & 148 nominations total,84,7.3,"250,862",tt1033575,"$82,584,160 "
651,The Disaster Artist,2017,8-Dec-17,104 min,"Biography, Comedy, Drama",James Franco,"Scott Neustadter, Michael H. Weber, Greg Sestero","James Franco, Dave Franco, Ari Graynor","Aspiring actor Greg Sestero befriends the eccentric Tommy Wiseau. The two travel to L.A, and when Hollywood rejects them, Tommy decides to write, direct, produce and star in their own movie. That movie is The Room, which has attained cult status as the ""Citizen Kane"" of bad movies.",English,United States,Nominated for 1 Oscar. 32 wins & 84 nominations total,76,7.3,"163,667",tt3521126,"$21,120,616 "
652,The Door,2008,12-Mar-10,17 min,"Short, Drama",Juanita Wilson,N/A,"Igor Sigov, Dzhuletta Gering, Liliyn Grechk","Sometime in 1986, or maybe 1987, in the dead of night, a man parks his motorcycle next to an empty amusement park. He hides from security guards as he finds his way to a block of flats and enters one. A guard smashes a window and yells at him to leave. He does, but he's carrying something from the flat. He is Nikolai, married to Anya, the father of Lena, who is a thin, ethereal waif. In what we later learn is a flashback, we see them packing to leave, hurried by authorities, who tell them to leave everything behind. What's going on, why can they bring nothing? And why would Nikolai return home, sometime later, to steal a door?",Russian,Ireland,Nominated for 1 Oscar. 4 wins & 1 nomination total,N/A,7.1,640,tt1381557,N/A
653,The Dress,2020,2-Jun-20,30 min,"Short, Drama",Tadeusz Lysiak,Tadeusz Lysiak,"Anna Dzieduszycka, Dorota Pomykala, Szymon Piotr Warszawski","A woman with limited hopes toils in a rundown motel in rural Poland, as a maid. Will the repeated visits of an interesting man, a truck driver, change the loneliness of her situation?",Polish,Poland,Nominated for 1 Oscar. 3 wins & 6 nominations total,N/A,6.7,"1,229",tt12299764,N/A
654,The Duchess,2008,10-Oct-08,110 min,"Biography, Drama, History",Saul Dibb,"Jeffrey Hatcher, Anders Thomas Jensen, Saul Dibb","Keira Knightley, Ralph Fiennes, Dominic Cooper","Georgiana Spencer became Duchess of Devonshire on her marriage to the Duke in 1774, at the height of the Georgian period, a period of fashion, decadence, and political change. Spirited and adored by the public at large she quickly found her marriage to be a disappointment, defined by her duty to produce a male heir and the Duke's philandering and callous indifference to her. She befriends Lady Bess but finds she is once again betrayed by her husband who wields his power with the three eventually living uncomfortably together. Against this background, and with the pressures of an unfaithful husband, strict social pressures and constant public scrutiny, Georgiana falls passionately in love with Charles Grey, a rising young Whig politician. However, despite his ongoing liaison with Lady Bess, the Duke refuses to allow her to continue the affair and threatens to take her children from her.",English,"United Kingdom, Italy, France, United States",Won 1 Oscar. 8 wins & 21 nominations total,62,6.9,"87,099",tt0864761,"$13,848,978 "
655,The Edge of Democracy,2019,19-Jun-19,121 min,"Documentary, History",Petra Costa,"Petra Costa, Carol Pires, David Barker","Dilma Rousseff, Luiz Inácio Lula da Silva, Marisa Letícia Lula da Silva","A cautionary tale for these times of democracy in crisis, the personal and political fuse in The Edge of Democracy to explore one of the most dramatic periods in Brazilian history. Combining unprecedented access to Presidents Lula da Silva and Dilma Rousseff with accounts of her own family's complex political and industrial past, filmmaker Petra Costa (Elena, 2012) witnesses their rise and fall and the tragically polarized nation that remains.","Portuguese, English",Brazil,Nominated for 1 Oscar. 3 wins & 15 nominations total,81,7.3,"15,649",tt6016744,N/A
656,The Elephant Whisperers,2022,8-Dec-22,41 min,"Documentary, Short",Kartiki Gonsalves,"Kartiki Gonsalves, Priscilla Gonsalves, Garima Pura Patiyaalvi","Bellie, Bomman","Bomman and Bellie, a couple in South India, devote their lives to caring for an orphaned baby elephant named Raghu, forging a family like no other that tests the barrier between the human and the animal world.",Tamil,India,Won 1 Oscar. 2 wins & 3 nominations total,N/A,7.5,"9,398",tt23628262,N/A
657,The Eleven O'Clock,2016,6-Sep-16,13 min,"Short, Comedy",Derin Seale,Josh Lawson,"Josh Lawson, Damon Herriman, Jessica Wren",The delusional patient of a psychiatrist believes he is actually the psychiatrist. As they each attempt to treat each other the session gets out of control.,English,Australia,Nominated for 1 Oscar. 5 wins & 1 nomination total,N/A,7.6,"1,031",tt6023474,N/A
658,The Eternal Memory,2023,7-Nov-23,85 min,Documentary,Maite Alberdi,Maite Alberdi,"Augusto Góngora, Paulina Urrutia, Gustavo Cerati","Augusto and Paulina have been together for 25 years. Eight years ago, he was diagnosed with Alzheimer's disease. Both fear the day he no longer recognizes her.",Spanish,"Chile, United States",Nominated for 1 Oscar. 11 wins & 20 nominations total,85,7.4,"2,554",tt24082488,"$67,594 "
659,The Eyes of Tammy Faye,2021,17-Sep-21,126 min,"Biography, Drama, Romance",Michael Showalter,"Fenton Bailey, Randy Barbato, Abe Sylvia","Jessica Chastain, Andrew Garfield, Cherry Jones","An intimate look at the extraordinary rise, fall, and redemption of televangelist Tammy Faye Bakker. In the 1970s and '80s, Tammy Faye and her husband Jim Bakker,rose from humble beginnings to create the world's largest religious broadcasting network and theme park, and were revered for their message of love, acceptance, and prosperity. Tammy Faye was legendary for her indelible eyelashes, her idiosyncratic singing, and her eagerness to embrace people from all walks of life. However, it wasn't long before financial improprieties, scheming rivals, and scandal toppled their carefully constructed empire.",English,United States,Won 2 Oscars. 22 wins & 45 nominations total,55,6.6,"38,721",tt9115530,"$2,404,127 "
660,The Fabelmans,2022,23-Nov-22,151 min,Drama,Steven Spielberg,"Steven Spielberg, Tony Kushner","Michelle Williams, Gabriel LaBelle, Paul Dano","Growing up in post-World War II era Arizona, young Sammy Fabelman aspires to become a filmmaker as he reaches adolescence, but soon discovers a shattering family secret and explores how the power of films can help him see the truth.",English,"United States, India",Nominated for 7 Oscars. 30 wins & 287 nominations total,84,7.5,"114,623",tt14208870,"$17,348,945 "
661,The Fantastic Flying Books of Mr. Morris Lessmore,2011,24-Sep-14,15 min,"Animation, Short, Adventure","William Joyce, Brandon Oldenburg",William Joyce,N/A,"Inspired, in equal measures, by Hurricane Katrina, Buster Keaton, The Wizard of Oz, and a love for books, The Fantastic Flying Books of Mr. Morris Lessmore is a poignant, humorous allegory about the curative powers of story. Using a variety of techniques (miniatures, computer animation, 2D animation) award winning author/ illustrator William Joyce and Co-director Brandon Oldenburg present a hybrid style of animation that harkens back to silent films and MGM Technicolor musicals. Morris Lessmore is old fashioned and cutting edge at the same time.","None, English",United States,Won 1 Oscar. 7 wins & 1 nomination total,N/A,7.8,"5,772",tt1778342,N/A
662,The Father,2020,26-Feb-21,97 min,"Drama, Mystery",Florian Zeller,"Christopher Hampton, Florian Zeller","Anthony Hopkins, Olivia Colman, Mark Gatiss","Having just scared off his recent caregiver, Anthony, an ailing, octogenarian Londoner gradually succumbing to dementia, feels abandoned when concerned Anne, his daughter, tells him she's moving to Paris. Confused and upset, against the backdrop of a warped perspective and his rapid, heart-rending mental decline, Anthony is starting to lose his grip on reality, struggling to navigate the opaque landscape of present and past. Now, as faded memories and glimpses of lucidity trigger sudden mood swings, dear ones, Anthony's surroundings, and even time itself become distorted. Why has his younger daughter stopped visiting? Who are the strangers that burst in on Anthony?",English,"United Kingdom, France, United States",Won 2 Oscars. 37 wins & 168 nominations total,88,8.2,"190,895",tt10272386,"$2,122,771 "
663,The Favourite,2018,21-Dec-18,119 min,"Biography, Comedy, Drama",Yorgos Lanthimos,"Deborah Davis, Tony McNamara","Olivia Colman, Emma Stone, Rachel Weisz","Early 18th century. England is at war with the French. Nevertheless, duck racing and pineapple eating are thriving. A frail Queen Anne (Olivia Colman) occupies the throne and her close friend Lady Sarah (Rachel Weisz) governs the country in her stead while tending to Anne's ill health and mercurial temper. When a new servant Abigail (Emma Stone) arrives, her charm endears her to Sarah. Sarah takes Abigail under her wing and Abigail sees a chance at a return to her aristocratic roots. As the politics of war become quite time consuming for Sarah, Abigail steps into the breach to fill in as the Queen's companion. Their burgeoning friendship gives her a chance to fulfill her ambitions and she will not let woman, man, politics or rabbit stand in her way.",English,"Ireland, United Kingdom, United States",Won 1 Oscar. 186 wins & 355 nominations total,91,7.5,"230,406",tt5083738,"$34,366,783 "
664,The Fighter,2010,17-Dec-10,116 min,"Action, Biography, Drama",David O. Russell,"Scott Silver, Paul Tamasy, Eric Johnson","Mark Wahlberg, Christian Bale, Amy Adams","The Fighter is a drama about boxer ""Irish"" Micky Ward's unlikely road to the world light welterweight title. His Rocky-like rise was shepherded by half-brother Dicky, a boxer-turned-trainer on the verge of being KO'd by drugs and crime.",English,United States,Won 2 Oscars. 74 wins & 123 nominations total,79,7.8,"387,309",tt0964517,"$93,617,009 "
665,The Final Inch,2008,1-Apr-09,38 min,"Documentary, Short",Irene Taylor,N/A,"Ashfaq Bhat, Mikail Davenport, Munzareen Fatima","Fifty years after the development of the polio vaccine in the United States, the potentially crippling polio virus still finds refuge in some of the world's most vulnerable places, poised to re-emerge and re-infect regions where it was stamped out decades ago. The first line of defense against such a nightmarish occurrence is a vast army of health workers who go door-to-door in some of India's poorest neighborhoods, ensuring every child is vaccinated. Their mission: to eradicate polio from the planet forever. From HBO.","English, Urdu, Hindi",United States,Nominated for 1 Oscar. 2 wins & 4 nominations total,N/A,8.4,73,tt1360061,N/A
666,The Florida Project,2017,10-Nov-17,111 min,Drama,Sean Baker,"Sean Baker, Chris Bergoch","Brooklynn Prince, Bria Vinaite, Willem Dafoe","Halley lives with her six year old daughter Moonee in a budget motel along one of the commercial strips catering to the Walt Disney World tourist clientele outside Orlando, Florida. Halley, who survives largely on welfare, has little respect for people, especially those who cross her, it an attitude that she has passed down to Moonee, who curses and gives the finger like her mother. Although the motel's policy is not to allow long term rentals, Bobby, the motel manager, has made arrangements for people like Halley to live there while not undermining the policy as he realizes that many such tenants have no place to go otherwise. Halley, Moonee and Moonee's friends, who live in the motel or others like it along the strip and who she often drags into her disruptive pranks, are often the bane of Bobby's existence, but while dealing with whatever problem arises, Bobby has a soft spot especially for the children and thus, by association, their parents, as he knows that Moonee and others like her are just children acting like a children under whatever guidance they have, Moonee who has less guidance than most. Although there are some lines which he will not tolerate to be crossed, Bobby lets most of the disruptive things that they do go, largely as long as it does not affect the bread and butter of the motel, namely the tourist trade. The summer in this collective is presented, when Moonee and her friends, such as Scooty, are out of school and are left largely to their own devices while self-absorbed Halley does whatever she wants, often just staying in the room watching TV. Halley is supposed to look after Scooty, the son of Halley's friend Ashley, they who live in the unit immediately underneath Halley and Moonee's, while Ashley is at work at a local diner. In turn, Ashley pilfers cooked meals from the diner to feed Halley, Moonee and Scooty. Over the course of the summer, Halley systematically begins to alienate one by one the people who are her unofficial support by responding with that disrespect to anything she feels is against her. As such, Halley begins to take more and more extreme measures to maintain the life she leads with Moonee.","English, Spanish, Portuguese",United States,Nominated for 1 Oscar. 66 wins & 132 nominations total,92,7.6,"127,297",tt5649144,"$5,904,366 "
667,The Flying Sailor,2022,20-Oct-22,8 min,"Animation, Short","Amanda Forbis, Wendy Tilby","Amanda Forbis, Wendy Tilby",N/A,A sailor is sent hurtling into the sky by the Halifax Explosion.,None,Canada,Nominated for 1 Oscar. 3 wins & 13 nominations total,N/A,5.9,"2,161",tt20240228,N/A
668,The Garden,2008,1-Apr-14,80 min,Documentary,Scott Hamilton Kennedy,Scott Hamilton Kennedy,"Danny Glover, Daryl Hannah, Antonio Villaraigosa","The 14 acre community garden in South Central Los Angeles was the largest of it's kind in the United States. It was started as a form of healing after the devastating L.A. riots in 1992. Since that time, the South Central Farmers have created a miracle in one of the country's most blighted neighborhoods. Growing their own food. Feeding their families. Creating a community. But now bulldozers threaten their oasis. The Garden is an unflinching look at the struggle between these urban farmers and the City of Los Angeles and a powerful developer who want to evict them and build warehouses.","English, Spanish",United States,Nominated for 1 Oscar. 1 win & 2 nominations total,N/A,7.3,749,tt1252486,"$26,931 "
669,The Gatekeepers,2012,19-Jun-13,101 min,"Documentary, History, War",Dror Moreh,N/A,"Ami Ayalon, Avraham Shalom, Avi Dichter","A documentary featuring interviews with all surviving former heads of Shin Bet, the Israeli security agency whose activities and membership are closely held state secrets.","Hebrew, English","Israel, France, Belgium, Canada",Nominated for 1 Oscar. 7 wins & 12 nominations total,91,7.6,"5,873",tt2309788,"$2,415,727 "
670,The Girl with the Dragon Tattoo,2011,21-Dec-11,158 min,"Crime, Drama, Mystery",David Fincher,"Steven Zaillian, Stieg Larsson","Daniel Craig, Rooney Mara, Christopher Plummer","Mikael Blomkvist is a disgraced journalist who is asked by a wealthy industrialist to write a biography on his family. But what he really wants Blomkvist to do is to find out what happened to his niece, who went missing 40 years ago. Blomkvist, at first, is not interested, till the man offers to help him clear his name. Blomkvist, begins by talking to the man's relatives who were there when the girl went missing. And some of them are not forth coming. Blomkvist eventually believes that her disappearance might have something to do with some serial killings that took place 20 years before she disappeared. So he asks for a research assistant. So the industrialist's man suggests Lisbeth Salander, a talented hacker who does background checks for them and who even did one on Blomkvist. When he sees her report, he's impressed and asks her to work with him and she does. She's anti-social but is extremely efficient.","English, Swedish","United States, Sweden, Norway",Won 1 Oscar. 26 wins & 91 nominations total,71,7.8,"493,227",tt1568346,"$102,515,793 "
