,Title,Year,Released,Runtime,Genre,Director,Writer,Actors,Plot,Language,Country,Awards,Metascore,imdbRating,imdbVotes,imdbID,BoxOffice
0,12 Years a Slave,2013,8-Nov-13,134 min,"Biography, Drama, History",Steve McQueen,"John Ridley, Solomon Northup","Chiwetel Ejiofor, Michael Kenneth Williams, Michael Fassbender","Based on an incredible true story of one man's fight for survival and freedom. In the pre-Civil War United States, Solomon Northup, a free black man from upstate New York, is abducted and sold into slavery. Facing cruelty personified by a malevolent slave owner, as well as unexpected kindnesses, Solomon struggles not only to stay alive, but to retain his dignity. In the twelfth year of his unforgettable odyssey, Solomon's chance meeting with a Canadian abolitionist will forever alter his life.",English,"United Kingdom, United States",Won 3 Oscars. 244 wins & 337 nominations total,96,8.1,"738,643",tt2024544,"$56,671,993 "
1,127 Hours,2010,28-Jan-11,94 min,"Biography, Drama",Danny Boyle,"Danny Boyle, Simon Beaufoy, Aron Ralston","James Franco, Amber Tamblyn, Kate Mara","127 Hours is the true story of mountain climber Aron Ralston's remarkable adventure to save himself after a fallen boulder crashes on his arm and traps him in an isolated canyon in Utah. Over the next five days Ralston examines his life and survives the elements to finally discover he has the courage and the wherewithal to extricate himself by any means necessary, scale a 65 foot wall and hike over eight miles before he can be rescued. Throughout his journey, Ralston recalls friends, lovers, family, and the two hikers he met before his accident. Will they be the last two people he ever had the chance to meet?","English, Italian","United States, France, United Kingdom",Nominated for 6 Oscars. 23 wins & 150 nominations total,82,7.5,"399,965",tt1542344,"$18,335,230 "
2,13 Hours,2016,15-Jan-16,144 min,"Action, Drama, History",Michael Bay,"Chuck Hogan, Mitchell Zuckoff","John Krasinski, Pablo Schreiber, James Badge Dale","Libya, 2012. At an unofficial CIA base in Benghazi a group of ex-military contractors are providing security. In the aftermath of Gaddafi's downfall a power vacuum exists and the climate is volatile. Military weapons are freely available. The US Ambassador to Libya, Chris Stevens, makes a visit to the area, staying in a compound near the CIA base. On the night of 11 September, 2012, the Ambassador's compound is attacked by hordes of heavily armed locals. The only forces willing and able to defend it are six CIA contractors.","English, Arabic","United States, Malta, Morocco",Nominated for 1 Oscar. 5 nominations total,48,7.3,"159,506",tt4172430,"$52,853,219 "
3,13th,2016,7-Oct-16,100 min,"Documentary, Crime, History",Ava DuVernay,"Spencer Averick, Ava DuVernay","Melina Abdullah, Michelle Alexander, Cory Booker","The film begins with the idea that 25 percent of the people in the world who are incarcerated are incarcerated in the U.S. Although the U.S. has just 5% of the world's population. ""13th"" charts the explosive growth in America's prison population; in 1970, there were about 200,000 prisoners; today, the prison population is more than 2 million. The documentary touches on chattel slavery; D. W. Griffith's film ""The Birth of a Nation""; Emmett Till; the civil rights movement; the Civil Rights Act of 1964; Richard M. Nixon; and Ronald Reagan's declaration of the war on drugs and much more.",English,United States,Nominated for 1 Oscar. 32 wins & 47 nominations total,81,8.2,"37,515",tt5895028,N/A
4,1917,2019,10-Jan-20,119 min,"Action, Drama, War",Sam Mendes,"Sam Mendes, Krysty Wilson-Cairns","Dean-Charles Chapman, George MacKay, Daniel Mays","April 1917, the Western Front. Two British soldiers are sent to deliver an urgent message to an isolated regiment. If the message is not received in time the regiment will walk into a trap and be massacred. To get to the regiment they will need to cross through enemy territory. Time is of the essence and the journey will be fraught with danger.","English, French, German","United Kingdom, United States, India, Spain",Won 3 Oscars. 135 wins & 207 nominations total,78,8.2,"669,206",tt8579674,"$159,227,644 "
5,20 Days in Mariupol,2023,21-Nov-23,95 min,"Documentary, War",Mstyslav Chernov,Mstyslav Chernov,"Mstyslav Chernov, Evgeniy Maloletka, Liudmyla Amelkina","As the Russian invasion begins, a team of Ukrainian journalists trapped in the besieged city of Mariupol struggle to continue their work documenting the war's atrocities.","Russian, Ukrainian, English","United States, Ukraine",Nominated for 1 Oscar. 28 wins & 50 nominations total,83,8.5,"5,853",tt24082438,N/A
6,20 Feet from Stardom,2013,26-Jul-13,91 min,"Documentary, Biography, History",Morgan Neville,Morgan Neville,"Darlene Love, Merry Clayton, Lisa Fischer","The backup singer exists in a strange place in the pop music world; they are always in the shadow of the feature artists even when they are in front of them in concert while they provide a vital foundation for the music. Through interviews with veterans and concert footage, the history of these predominately African-American singers is explored through the rock era. Furthermore, special focus is given to special stand outs who endeavored to make a living in the art burdened with a low profile and more personal career frustrations, especially those who faced the very different challenge of singing in the spotlight themselves.","English, Spanish",United States,Won 1 Oscar. 22 wins & 27 nominations total,83,7.4,"13,926",tt2396566,"$4,946,445 "
7,20th Century Women,2016,20-Jan-17,119 min,"Comedy, Drama",Mike Mills,Mike Mills,"Annette Bening, Elle Fanning, Greta Gerwig","Love, life, and the struggles of a mother bringing up a son in the late 70's. The ignorance of a free spirit against the needs of a young man trying to find his true character and beliefs. Living in a bohemian household shared with three like minded spirited people to help pay the rent, his mother tries to establish bonds that he cannot deal with. She cannot deal with his inability to talk, and enlists the help of other females in his life to share the burden of his upbringing. Slowly life unravels for them all without understanding how. In spite of their perceived struggles, they all go on to live defined lives without any serious consequences.",English,United States,Nominated for 1 Oscar. 15 wins & 82 nominations total,83,7.3,"49,217",tt4385888,"$5,664,764 "
8,4.1 Miles,2016,1-Sep-16,26 min,"Documentary, Short",Daphne Matziaraki,N/A,"DJ Express, Christos Sapounas, Giorgos Tsagarellis",A coast guard captain on a small Greek island is suddenly charged with saving thousands of refugees from drowning at sea.,"Greek, English, Arabic, Dari",United States,Nominated for 1 Oscar. 3 wins & 2 nominations total,N/A,7.6,969,tt6279726,N/A
9,45 Years,2015,28-Aug-15,95 min,"Drama, Romance",Andrew Haigh,"Andrew Haigh, David Constantine","Charlotte Rampling, Tom Courtenay, Geraldine James","Kate (Charlotte Rampling) and Geoff Mercer (Sir Tom Courtenay) are planning to celebrate their 45th wedding anniversary with dozens of friends. The event is to take place soon in the community hall of Norwich, the town near which they live. A week before the party, Geoff receives a letter which, although he tries to hide it, obviously troubles him. When his wife asks him what is going on, Geoff tells her that the body of Katya, his first great love who disappeared fifty years before in the Alps, has just been found in a melting glacier. From then on, Geoff starts behaving more and more strangely and for the first time after so many years Kate asks herself who the man she married so long ago really is.",English,United Kingdom,Nominated for 1 Oscar. 21 wins & 62 nominations total,94,7.1,"35,068",tt3544082,"$4,247,285 "
10,5 Broken Cameras,2011,N/A,94 min,"Documentary, War","Emad Burnat, Guy Davidi",Guy Davidi,"Emad Burnat, Soraya Burnat, Mohammed Burnat","When his fourth son, Gibreel, is born, Emad, a Palestinian villager, gets his first camera. In his village, Bil'in, a separation barrier is being built and the villagers start to resist this decision. For more than five years, Emad films the struggle, which is led by two of his best friends, alongside filming how Gibreel grows. Very soon it affects his family and his own life. Daily arrests and night raids scare his family; his friends, brothers and himself are either shot or arrested. One camera after another is shot at or smashed. Each of the 5 cameras tells part of his story.","Hebrew, Arabic","Occupied Palestinian Territory, Israel, France, Netherlands",Nominated for 1 Oscar. 18 wins & 10 nominations total,78,7.9,"6,450",tt2125423,"$109,983 "
11,A Beautiful Day in the Neighborhood,2019,22-Nov-19,109 min,"Biography, Drama",Marielle Heller,"Micah Fitzerman-Blue, Noah Harpster, Tom Junod","Matthew Rhys, Tom Hanks, Chris Cooper","Two-time Oscar®-winner Tom Hanks portrays Mister Rogers in A Beautiful Day in the Neighborhood, a timely story of kindness triumphing over cynicism, based on the true story of a real-life friendship between Fred Rogers and journalist Tom Junod. After a jaded magazine writer (Emmy winner Matthew Rhys) is assigned a profile of Fred Rogers, he overcomes his skepticism, learning about empathy, kindness, and decency from America's most beloved neighbor.",English,"United States, China",Nominated for 1 Oscar. 10 wins & 64 nominations total,80,7.2,"88,138",tt3224458,"$61,704,055 "
12,A Cat in Paris,2010,15-Dec-10,70 min,"Animation, Adventure, Comedy","Jean-Loup Felicioli, Alain Gagnol","Alain Gagnol, Jacques-Rémy Girerd","Dominique Blanc, Bernadette Lafont, Bruno Salomone","Dino is a cat that leads a double life. By day, he lives with Zoe, a little girl whose mother, Jeanne, is a police officer. By night, he works with Nico, a burglar with a big heart. Zoe has plunged herself into silence following her father's murder at the hands of gangster Costa. One day, Dino the cat brings Zoe a very valuable bracelet. Lucas, Jeanne's second-in-command, notices this bracelet is part of a jewelery collection that has been stolen. One night, Zoe decides to follow Dino. On the way, she overhears some gangsters and discovers that her nanny is part of the gangsters' team.","French, English","France, Belgium",Nominated for 1 Oscar. 1 win & 6 nominations total,63,6.9,"11,865",tt1673702,"$309,973 "
13,A Concerto Is a Conversation,2021,24-Nov-20,13 min,"Documentary, Short, Drama","Kris Bowers, Ben Proudfoot",Ben Proudfoot,"Kris Bowers, Horace Bowers Sr., Jim Burke",A virtuoso jazz pianist and film composer tracks his family's lineage through his 91-year-old grandfather from Jim Crow Florida to the Walt Disney Concert Hall.,English,United States,Nominated for 1 Oscar. 3 wins & 2 nominations total,N/A,6.9,"1,394",tt13793326,N/A
14,A Fantastic Woman,2017,2-Feb-18,104 min,Drama,Sebastián Lelio,"Sebastián Lelio, Gonzalo Maza, Eliseo Altunaga","Daniela Vega, Francisco Reyes, Luis Gnecco","Somewhere in Santiago at a dimly-lit nightclub, Orlando, the kindly and well-off owner of a textile company, locks eyes with Marina, a hopeful singer and the roughly half-his-age love of his life. But, unfortunately, after Marina's birthday celebration and a night of passion, Orlando falls gravely ill--and by the following morning--he dies in hospital. In the wake of her companion's untimely death, Marina will soon realise that, from now on, everything is brought into question: her involvement in Orlando's death, their unconventional relationship; and above all, her right to mourn her beloved deceased. In the end, what was Marina's crime; a deed so hideous that would rob a fantastic woman of her respect, her dignity, and ultimately, her identity?","Spanish, Chinese","Chile, Spain, Germany",Won 1 Oscar. 32 wins & 43 nominations total,84,7.2,"27,224",tt5639354,"$2,020,988 "
15,A Girl in the River: The Price of Forgiveness,2015,28-Oct-15,40 min,"Documentary, Short",Sharmeen Obaid-Chinoy,François-Xavier Durandy,"Asad Jamal, Saba","The extraordinary story of a young Pakistani woman who lived to tell of her narrow escape from an attempted ""honor"" killing by her father and uncle. Told through the lens of a true love story, the film tells the story of Saba who was shot and left for dead after marrying a man once promised to her. The result is a scathing examination of the contradictions between modernism and tradition within Pakistani society.",Punjabi,"United States, Pakistan",Won 1 Oscar. 3 wins & 2 nominations total,N/A,7.8,"1,787",tt5144072,N/A
16,A House Made of Splinters,2022,21-Feb-23,87 min,Documentary,Simon Lereng Wilmont,N/A,"Marharyta Burlutska, Anjelika Stolyarova, Olga Tronova",Children and staff in a special kind of home: an institution for children who have been removed from their homes while awaiting court custody decisions. Staff do their best to make the time children have there safe and supportive.,"Russian, Ukrainian","Denmark, Ukraine, Sweden, Germany, Finland",Nominated for 1 Oscar. 10 wins & 15 nominations total,79,7.2,"2,061",tt16377920,N/A
17,A Love Song for Latasha,2019,21-Sep-20,19 min,"Documentary, Short, Biography",Sophia Nahli Allison,N/A,"Tybie O'Bard, Shinese Harlins, Zoe Flint",A Love Song For Latasha is a dreamlike hybrid documentary in conversation with the past and the present to reimagine a more nuanced narrative of Latasha Harlins than standard archival practises have captured by excavating intimate and poetic memories shared by her cousin and best friend.,English,United States,Nominated for 1 Oscar. 6 wins & 6 nominations total,N/A,6.8,"2,606",tt8993180,N/A
18,A Man Called Ove,2015,30-Sep-16,116 min,"Comedy, Drama, Romance",Hannes Holm,"Hannes Holm, Fredrik Backman","Rolf Lassgård, Bahar Pars, Filip Berg","59 year old Ove is the block's grumpy man who several years earlier was deposed as president of the condominium association, but he could not give a damn about being deposed and therefore keeps looking over the neighborhood with an iron fist. When pregnant Parvaneh and her family moves into the terraced house opposite and accidentally backs into Ove's mailbox it turns out to be an unexpected friendship. A drama comedy about unexpected friendship, love and the importance of surrounding yourself with the proper tools.","Swedish, Persian, Spanish",Sweden,Nominated for 2 Oscars. 15 wins & 29 nominations total,70,7.7,"68,019",tt4080728,"$3,479,315 "
19,How They Donut: A Matter of Loaf and Death,2009,2-Nov-09,20 min,"Documentary, Short",Toby James,N/A,N/A,Wallace and Gromit run a bakery. Recently twelve bakers have been murdered. Will they be next or can they catch the killer?,English,UK,Nominated for 1 Oscar. 2 wins & 3 nominations total,N/A,6.5,13,tt11303566,N/A
20,A Morning Stroll,2011,10-Feb-12,7 min,"Animation, Short, Action",Grant Orchard,"Casper G. Clausen, Grant Orchard",N/A,"Set against the background of New York's bustling streets, this is the story of a true urban dweller: a hefty and fluffy white chicken. Spanning a century in 50-year intervals, starting off in 1959, this is a documentation of diverse time periods as well as the human evolution, pivoting around the same street corner of a single city block.",English,United Kingdom,Nominated for 1 Oscar. 6 wins & 5 nominations total,N/A,6.6,805,tt1964446,N/A
21,A Night at the Garden,2017,N/A,7 min,"Documentary, Short, History",Marshall Curry,N/A,Fritz Kuhn,"Assembled from archive footage, this short documentary details a 'German-American Bund' rally held at the Madison Square Garden on February 20, 1939. American Nazi leader Fritz Kuhn speaks to the gathered crowd when one man, 26-year-old Isadore Greenbaum, rushes the stage to protest the gathered National Socialist Party.",English,United States,Nominated for 1 Oscar. 1 win & 4 nominations total,N/A,6.6,"1,582",tt7535612,N/A
22,A Prophet,2009,26-Mar-10,155 min,"Crime, Drama",Jacques Audiard,"Thomas Bidegain, Jacques Audiard, Abdel Raouf Dafri","Tahar Rahim, Niels Arestrup, Adel Bencherif","Nineteen year-old Franco-Algerian Malik El Djebena is just starting his six year prison sentence in Brécourt. Although he has spent the better part of his life in juvenile detention, this stint is his first in an adult prison. Beyond the division of Corsicans and Muslims in the prison (the Corsicans who with their guard connections rule what happens in the prison), he has no known friends or enemies inside. He is just hoping to serve his time in peace and without incident, despite having no prospects once he's out of jail since he's illiterate and has no support outside of the prison. Due to logistics, the head of Corsican inmates, a sadistic mafioso named César Luciani, co-opts Malik as part of the Corsicans' activities, not only regarding what happens inside the prison, but also continued criminal activities outside. The innocent Malik has no idea what to do but cooperate. This move does not sit well with the other Corsicans, who only see Malik as a dirty Algerian, and the Muslims who now mistrust him. But as time goes on, Malik works to save himself while in prison, while setting up his life post prison on his own terms. Both his demon and his salvation in prison is the specter of one of the first people he really got to know during his incarceration.","French, Arabic, Corsican","France, Italy",Nominated for 1 Oscar. 52 wins & 55 nominations total,90,7.8,"101,976",tt1235166,"$2,087,720 "
23,A Quiet Place,2018,6-Apr-18,90 min,"Drama, Horror, Sci-Fi",John Krasinski,"Bryan Woods, Scott Beck, John Krasinski","Emily Blunt, John Krasinski, Millicent Simmonds","In a devastated Earth overrun by invincible predators of a possible extraterrestrial origin, the Abbotts find themselves struggling to survive in the isolation of upstate New York, defined by a new era of utter silence. Indeed, as this new type of invader is attracted to noise, even the slightest of sounds can be deadly; however, it's been already twelve months since the powerful monsters' first sightings, and this resilient family still stands strong. Of course, learning the rules of survival in this muted dystopia is essential; nevertheless, now, of all times, an otherwise joyous event puts in jeopardy the already fragile stability. And now, more than ever, the Abbotts must not make a sound.","American Sign , English",United States,Nominated for 1 Oscar. 37 wins & 128 nominations total,82,7.5,"581,699",tt6644200,"$188,024,361 "
24,A Royal Affair,2012,29-Mar-12,137 min,"Biography, Drama, History",Nikolaj Arcel,"Bodil Steensen-Leth, Rasmus Heisterberg, Nikolaj Arcel","Alicia Vikander, Mads Mikkelsen, Mikkel Boe Følsgaard","In 1767, the British Princess Caroline is betrothed to the mad King Christian VII of Denmark, but her life with the erratic monarch in the oppressive country becomes an isolating misery. However, Christian soon gains a fast companion with the German Dr. Johann Struensee, a quietly idealistic man of the Enlightenment. As the only one who can influence the King, Struensee is able to begin sweeping enlightened reforms of Denmark through Christian even as Caroline falls for the doctor. However, their secret affair proves a tragic mistake that their conservative enemies use to their advantage in a conflict that threatens to claim more than just the lovers as their victims.","Danish, English, German, French","Denmark, Sweden, Czech Republic, Germany",Nominated for 1 Oscar. 21 wins & 42 nominations total,73,7.5,"50,335",tt1276419,"$1,546,761 "
25,A Separation,2011,16-Mar-11,123 min,Drama,Asghar Farhadi,Asghar Farhadi,"Payman Maadi, Leila Hatami, Sareh Bayat","Nader (Payman Maadi) and Simin (Leila Hatami) argue about living abroad. Simin prefers to live abroad to provide better opportunities for their only daughter, Termeh. However, Nader refuses to go because he thinks he must stay in Iran and take care of his father (Ali-Asghar Shahbazi), who suffers from Alzheimers. However, Simin is determined to get a divorce and leave the country with her daughter.",Persian,"Iran, France, Australia",Won 1 Oscar. 88 wins & 52 nominations total,95,8.3,"257,533",tt1832382,"$7,099,055 "
26,A Serious Man,2009,6-Nov-09,106 min,"Comedy, Drama","Ethan Coen, Joel Coen","Joel Coen, Ethan Coen","Michael Stuhlbarg, Richard Kind, Sari Lennick","Bloomington, Minnesota, 1967: Jewish physics lecturer Larry Gopnik is a serious and a very put-upon man. His daughter is stealing from him to save up for a nose job, his pot-head son, who gets stoned at his own bar-mitzvah, only wants him round to fix the TV aerial and his useless brother Arthur is an unwelcome house guest. But both Arthur and Larry get turfed out into a motel when Larry's wife Judy, who wants a divorce, moves her lover, Sy, into the house and even after Sy's death in a car crash they are still there. With lawyers' bills mounting for his divorce, Arthur's criminal court appearances and a land feud with a neighbour Larry is tempted to take the bribe offered by a student to give him an illegal exam pass mark. And the rabbis he visits for advice only dole out platitudes. Still God moves in mysterious - and not always pleasant - ways, as Larry and his family will find out.","English, Yiddish, Hebrew","United Kingdom, France, United States",Nominated for 2 Oscars. 17 wins & 80 nominations total,88,7,"149,376",tt1019452,"$9,228,768 "
27,A Shaun the Sheep Movie: Farmageddon,2019,14-Feb-20,86 min,"Animation, Adventure, Comedy","Will Becher, Richard Phelan","Mark Burton, Jon Brown, Richard Starzak","Justin Fletcher, John Sparkes, Amalia Vitale","There is something strange going on in the peaceful town of Mossingham, right after the fantastic rescue mission in Shaun the Sheep Movie (2015). As mischievous Shaun orders in pizza for the woolly flock under the nose of the Farmer, and Bitzer, the ever-watchful sheepdog, a mysterious, fast-moving UFO enters the Earth's atmosphere and crash-lands near the verdant Mossy Bottom Farm. Now, Lu-La, the extraordinary friendly creature from the depths of the galaxy, is in grave danger, light-years away from home. Can Shaun, and the rest of the lambs, lend a helping hand, and protect their new extraterrestrial companion from the Ministry of Alien Detection, and its unstoppable leader, Agent Red?",English,"United Kingdom, France",Nominated for 1 Oscar. 2 wins & 22 nominations total,79,6.8,"15,528",tt6193408,N/A
28,A Single Life,2014,1-Sep-14,3 min,"Animation, Short, Comedy","Marieke Blaauw, Joris Oprins, Job Roggeveen","Job Roggeveen, Joris Oprins, Marieke Blaauw",N/A,"Alone in her apartment, a beautiful young woman is anxious to play her newest 45rpm record single. And then, as if by magic, much to her surprise, the avid audiophile is transported through time; every time the record skips, a different place awaits her. What a puzzling and magical single.",None,Netherlands,Nominated for 1 Oscar. 11 wins & 2 nominations total,N/A,7.3,"1,827",tt3838700,N/A
29,A Single Man,2009,5-Feb-10,99 min,"Crime, Drama, Romance",Tom Ford,"Christopher Isherwood, Tom Ford, David Scearce","Colin Firth, Julianne Moore, Matthew Goode","It's November 30, 1962. Native Brit George Falconer, an English professor at a Los Angeles area college, is finding it difficult to cope with life. Jim, his personal partner of sixteen years, died in a car accident eight months earlier when he was visiting with family. Jim's family were not going to tell George of the death or accident, let alone allow him to attend the funeral. This day, George has decided to get his affairs in order before he will commit suicide that evening. As he routinely and fastidiously prepares for the suicide and post suicide, George reminisces about his life with Jim. But George spends this day with various people, who see a man sadder than usual and who affect his own thoughts about what he is going to do. Those people include Carlos, a Spanish immigrant/aspiring actor/gigolo recently arrived in Los Angeles; Charley, his best friend who he knew from England, she who is a drama queen of a woman who romantically desires her best friend despite his sexual orientation; and Kenny Potter, one of his students, who seems to be curious about his professor beyond English class.","English, Spanish",United States,Nominated for 1 Oscar. 39 wins & 59 nominations total,77,7.5,"117,232",tt1315981,"$9,176,000 "
30,A Sister,2018,1-Oct-18,17 min,"Short, Drama, Thriller",Delphine Girard,Delphine Girard,"Veerle Baetens, Selma Alaoui, Guillaume Duhesme",A night. A car. Alie is in danger. To get by she must make the most important phone call of her life.,French,Belgium,Nominated for 1 Oscar. 5 wins & 3 nominations total,N/A,7.5,"1,621",tt8767544,"$330,661 "
31,A Star Is Born,2018,5-Oct-18,136 min,"Drama, Music, Romance",Bradley Cooper,"Eric Roth, Bradley Cooper, Will Fetters","Lady Gaga, Bradley Cooper, Sam Elliott","Seasoned musician Jackson Maine (Bradley Cooper) discovers-and falls in love with-struggling artist Ally (Gaga). She has just about given up on her dream to make it big as a singer - until Jack coaxes her into the spotlight. But even as Ally's career takes off, the personal side of their relationship is breaking down, as Jack fights an ongoing battle with his own internal demons.","English, French",United States,Won 1 Oscar. 98 wins & 290 nominations total,88,7.6,"417,346",tt1517451,"$215,333,122 "
