,Title,Year,Released,Runtime,Genre,Director,Writer,Actors,Plot,Language,Country,Awards,Metascore,imdbRating,imdbVotes,imdbID,BoxOffice
219,Extremis,2016,16-Sep-16,24 min,"Documentary, Short",Dan Krauss,N/A,"Monica Bhargava, Jessica Zitter","Witness the wrenching emotions that accompany end-of-life decisions as doctors, patients and families in a hospital ICU face harrowing choices.",English,United States,Nominated for 1 Oscar. 2 wins & 5 nominations total,N/A,7.3,"2,608",tt5538078,N/A
220,Faces Places,2017,28-Jun-17,94 min,Documentary,"JR, Agnès Varda","JR, Agnès Varda","Agnès Varda, JR, Jeannine Carpentier","Agnes Varda, one of the leading lights of France's honored French New Wave cinema era, and professional photographer and muralist, J.R., partake on a special art project. Together, they travel around France in a special box truck equipped as a portable photo booth and traveling printing facility as they take photographs of people around the country. With that inspiration, they also create special colossal mural pictures of individuals, communities and places they want to honor and celebrate. Along the way, the old cinematic veteran and the young artistic idealist enjoy an odd friendship as they chat and explore their views on the world as only they can.",French,France,Nominated for 1 Oscar. 36 wins & 41 nominations total,94,7.8,"13,510",tt5598102,"$953,717 "
221,Facing Fear,2013,13-Jul-13,23 min,"Documentary, Short, Drama",Jason Cohen,Jason Cohen,N/A,"The worlds of a former neo-Nazi and the gay victim of his senseless hate crime attack collide by chance 25 years after the incident that dramatically shaped both of their lives. They proceed to embark on a journey of forgiveness that challenges both to grapple with their beliefs and fears, eventually leading to an improbable collaboration...and friendship.",English,United States,Nominated for 1 Oscar. 1 nomination total,N/A,7,205,tt2776636,N/A
222,Fantastic Beasts and Where to Find Them,2016,18-Nov-16,132 min,"Adventure, Family, Fantasy",David Yates,J.K. Rowling,"Eddie Redmayne, Katherine Waterston, Alison Sudol","In mid-1920s New York, Newt Scamander, a British young activist wizard, arrives in the city, holding a mysterious leather suitcase that shelters diverse and magical creatures that exist among us. Amid an already fragile equilibrium of secrecy, and the increasing disasters ascribed to the dark wizard, Gellert Grindelwald, Newt's precious suitcase goes missing, and to make matters worse, several creatures manage to escape. Before long, this unforeseen complication catches Senior Auror Percival Graves' attention who targets Newt, against the backdrop of an invisible, devastating, and utterly unpredictable menace that still wreaks havoc on 5th Avenue. In the end, is there a hidden agenda behind Graves' intentions? Moreover, what will happen to the remaining fantastic beasts that are still on the loose?","English, Central Khmer","United Kingdom, United States",Won 1 Oscar. 15 wins & 54 nominations total,66,7.2,"505,865",tt3183660,"$234,037,575 "
223,Fantastic Mr. Fox,2009,25-Nov-09,87 min,"Animation, Adventure, Comedy",Wes Anderson,"Roald Dahl, Wes Anderson, Noah Baumbach","George Clooney, Meryl Streep, Bill Murray","This is the story of Mr. Fox (George Clooney) and his wild ways of hen heckling, turkey taking, and cider sipping, nocturnal, instinctive adventures. He has to put his wild days behind him and do what fathers do best: be responsible. He is too rebellious. He is too wild. He is going to try ""just one more raid"" on the three nastiest, meanest farmers that are Walter Boggis (Robin Hurlstone), Nathan Bunce (Hugo Guinness), and Franklin Bean (Sir Michael Gambon). It is a tale of crossing the line of family responsibilities and midnight adventure and the friendships and awakenings of this country life that is inhabited by Fantastic Mr. Fox and his friends.","English, French","United States, Australia, United Kingdom, Canada, New Zealand",Nominated for 2 Oscars. 32 wins & 63 nominations total,83,7.9,"268,594",tt0432283,"$21,002,919 "
224,Fauve,2018,15-Aug-20,17 min,"Short, Drama",Jérémy Comte,Jérémy Comte,"Félix Grenier, Alexandre Perreault, Louise Bombardier","Set in a surface mine, two boys sink into a seemingly innocent power game with Mother Nature as the sole observer.",French,Canada,Nominated for 1 Oscar. 28 wins & 11 nominations total,N/A,7.6,"3,552",tt7467476,N/A
225,Feast,2014,7-Nov-14,6 min,"Animation, Short, Comedy",Patrick Osborne,"Nicole Mitchell, Raymond S. Persi, Patrick Osborne","Steve Apostolina, Kirk Baily, Ben Bledsoe","A lively and always-hungry Boston Terrier living on the streets after being abandoned, encounters during his nightly escapades for food in the dumpsters a kind-hearted man who decides to take him home and name him Winston. At last, Winston can now have all the food and companionship in the world, and his diet evolves as the years go by.",English,"United States, Japan",Won 1 Oscar. 3 wins total,N/A,8.2,"24,002",tt3689498,N/A
226,Feeling Through,2019,20-Jan-21,18 min,"Short, Drama",Doug Roland,Doug Roland,"Steven Prescod, Robert Tarango, Francisco Burgos","While wandering the neon-lit streets of New York City, desperate to find shelter, Tereek, an unhoused teenager living on the margins of society, comes across Artie, a deafblind man trying to get home. Reluctantly, Tereek decides to lend a hand, only to find himself bonding with his unlikely new friend. And, little by little, as the perfect strangers embark on a silent, night-long journey in the heart of the city, a life-altering transformation begins to take place. Is love the essence and purpose of being human?",English,United States,Nominated for 1 Oscar. 123 wins & 34 nominations total,N/A,7.5,"1,990",tt9280166,N/A
227,Fences,2016,25-Dec-16,139 min,Drama,Denzel Washington,August Wilson,"Denzel Washington, Viola Davis, Stephen McKinley Henderson","Troy Maxson makes his living as a sanitation worker in 1950s Pittsburgh. Maxson once dreamed of becoming a professional baseball player, but was deemed too old when the major leagues began admitting black athletes. Bitter over his missed opportunity, Troy creates further tension in his family when he squashes his son's chance to meet a college football recruiter.",English,"United States, Canada",Won 1 Oscar. 60 wins & 122 nominations total,79,7.2,"117,586",tt2671706,"$57,682,904 "
228,Feral,2012,1-Aug-12,13 min,"Animation, Short, Drama",Daniel Sousa,Daniel Sousa,"Elsie McKendry, Brett Tobasky","A wild boy is found in the woods by a solitary hunter and brought back to civilization. Alienated by a strange new environment, the boy tries to adapt by using the same strategies that kept him safe in the forest.",English,United States,Nominated for 1 Oscar. 8 wins & 7 nominations total,N/A,6.4,973,tt2499022,N/A
229,Ferdinand,2017,15-Dec-17,108 min,"Animation, Adventure, Comedy",Carlos Saldanha,"Robert L. Baird, Tim Federle, Brad Copeland","John Cena, Kate McKinnon, Bobby Cannavale","Destined to become a fearless fighting bull, the young pacifist and flower-loving calf, Ferdinand, summons up the courage to escape from a Spanish bull-training camp, to finally find himself on little Nina's idyllic and fragrant farm. However, an unfortunate run-in with a busy golden bee will send the immense but peaceful animal back to the old Casa del Toro academy, where the famous matador, El Primero, usually selects his worthy bovine opponents for the arena. Does Ferdinand hide a fierce champion underneath a mountain of muscles, or is he a gentle giant after all?","English, Russian, Spanish, Ukrainian, German","United States, United Kingdom",Nominated for 1 Oscar. 2 wins & 22 nominations total,58,6.7,"63,125",tt3411444,"$84,410,380 "
230,Finding Vivian Maier,2013,17-Apr-14,83 min,"Documentary, Biography, Mystery","John Maloof, Charlie Siskel","John Maloof, Charlie Siskel","Vivian Maier, John Maloof, Daniel Arnaud","Real estate agent John Maloof explains how a trip to a local auction house, in search for old pictures to use for a history book about his neighborhood, resulted in him bidding and winning a box full of old negatives. John goes through the massive quantity of negatives, describes how impressed he is by the quality of the images, becomes quickly determined they are not reverent to his project and just puts them away. That could have very likely had been the end of the story, if the power of the images had not pushed him to fall in love with photography. John confides that his photo hobby quickly motivated him to set up a darkroom and devote large amounts of time printing. As he learned more about photography, he recognized that those negatives he had bought, then stored, were the work of a real master. In an attempt to confirm his suspicion, he selected about 100 images and put them online with the hope that the feedback would confirm his judgement as to the strength of the images.","English, French",United States,Nominated for 1 Oscar. 12 wins & 23 nominations total,75,7.7,"15,008",tt2714900,"$1,514,782 "
231,Fire at Sea,2016,18-Feb-16,114 min,Documentary,Gianfranco Rosi,"Gianfranco Rosi, Carla Cattani","Samuele Pucillo, Mattias Cucina, Samuele Caruana","Situated some 200km off Italy's southern coast, Lampedusa has hit world headlines in recent years as the first port of call for hundreds of thousands of African and Middle Eastern migrants hoping to make a new life in Europe. Rosi spent months living on the Mediterranean island, capturing its history, culture and the current everyday reality of its 6,000-strong local population as hundreds of migrants land on its shores on a weekly basis. The resulting documentary focuses on 12-year-old Samuele, a local boy who loves to hunt with his slingshot and spend time on land even though he hails from a culture steeped in the sea.","Italian, English","Italy, France",Nominated for 1 Oscar. 16 wins & 28 nominations total,87,6.7,"6,035",tt3652526,"$120,933 "
232,Fire of Love,2022,11-Nov-22,98 min,"Documentary, Biography",Sara Dosa,"Sara Dosa, Erin Casper, Jocelyne Chaput","Katia Krafft, Maurice Krafft, Miranda July",Intrepid scientists and lovers Katia and Maurice Krafft died in a volcanic explosion doing the very thing that brought them together: unraveling the mysteries of volcanoes by capturing the most explosive imagery ever recorded.,"French, English","Canada, United States",Nominated for 1 Oscar. 34 wins & 66 nominations total,83,7.6,"14,185",tt16227014,"$1,120,412 "
233,First Man,2018,12-Oct-18,141 min,"Biography, Drama, History",Damien Chazelle,"Josh Singer, James R. Hansen","Ryan Gosling, Claire Foy, Jason Clarke","A Biopic on the life of the legendary American Astronaut Neil Armstrong from 1961-1969, on his journey to becoming the first human to walk the moon. Exploring the sacrifices and costs on the Nation and Neil himself, during one of the most dangerous missions in the history of space travel.",English,"United States, Japan, China",Won 1 Oscar. 32 wins & 193 nominations total,84,7.3,"201,517",tt1213641,"$44,936,545 "
234,First Reformed,2017,8-Jun-18,113 min,"Drama, Mystery, Thriller",Paul Schrader,Paul Schrader,"Ethan Hawke, Amanda Seyfried, Cedric The Entertainer","Forty-six year old Reverend Ernst Toller is the pastor at the historic First Reformed Church in upstate New York. It is seen as the ""tourist"" church or the ""souvenir shop"" (its historical significance partly it being a stop on the underground railroad before the slaves crossed into Canada) by Abundant Life, which owns the church and which operates a modern self-named five thousand seat church overseen by Reverend Joel Jeffers. First Reformed is celebrating its two hundred fiftieth anniversary this year, for which a major event is planned, modest in size only at First Reformed itself although the dignitaries like the governor and mayor will be at attendance there, while the event will be simulcast at Abundant Life. Most of the speech-making will be done by local industrialist Ed Balq, a major benefactor of Abundant Life and who is the major donor for the necessary upgrades at First Reformed to be able to hold the event there, and for the event itself, while Toller's participation will be minimal beyond the introductory sermon. First Reformed is generally a sparsely attended church meaning that Toller doesn't have to do much direct ministering, although he does have the stock answers when asked how God factors into this or that situation in one's life. Toller himself has long been divorced, his marriage which could not survive the death of their son, Joseph, in war. Because of that history, Toller believes he is incapable of human love, despite a brief relationship with Esther, the choir mistress at Abundant Life, she who is arguably still in love with him. Toller is neglecting the warning signs about his poor health, the symptoms pointing to a probable diagnosis of stomach cancer, which is only exacerbated by his largely liquid (i.e. alcohol) diet. Toller is already examining his life and work in writing a daily journal for a year, that journal which he intends no one ever to read, but these issues in Toller's life become more pointed when a new pregnant congregant, Mary, asks him to speak to her husband Michael, who Toller will learn is an environmentalist concerned about bringing another human life into what he already sees as a world doomed because of man's role in climate change.",English,"United States, United Kingdom, Australia",Nominated for 1 Oscar. 61 wins & 109 nominations total,86,7.1,"62,249",tt6053438,"$3,448,256 "
235,Flee,2021,17-Jun-21,89 min,"Documentary, Animation, Biography",Jonas Poher Rasmussen,"Jonas Poher Rasmussen, Amin Nawabi","Daniel Karimyar, Fardin Mijdzadeh, Milad Eskandari","An animated documentary telling the true story about a man's need to confront his past in order to truly have a future. Amin arrived as an unaccompanied minor in Denmark from Afghanistan. Today, at 36, he is a successful academic and is getting married to his long-time boyfriend. A secret he has been hiding for over 20 years threatens to ruin the life he has built for himself. For the first time, he is sharing his story with his close friend.","Spanish, Danish, English, Dari, Russian, Swedish","Denmark, France, Norway, Sweden, Netherlands, United Kingdom, United States, Finland, Italy, Spain, Estonia, Slovenia",Nominated for 3 Oscars. 96 wins & 150 nominations total,91,7.9,"19,360",tt8430054,"$339,754 "
236,Flight,2012,2-Nov-12,138 min,"Drama, Thriller",Robert Zemeckis,John Gatins,"Denzel Washington, Nadine Velazquez, Don Cheadle","Whip Whitaker is a commuter airline pilot. While on a flight from Orlando to Atlanta something goes wrong and the plane starts to fly erratically. With little choice Whip crashes the plane and saves almost all on board. When he wakes up in the hospital, his friend from the airline union introduces him to a lawyer who tells him there's a chance he could face criminal charges because his blood test reveals that he was intoxicated with alcohol and cocaine. He denies being impaired, so while an investigation is underway, he is told to keep his act together. However, letting go of his addiction is not as easy as it seems...",English,"United States, United Arab Emirates",Nominated for 2 Oscars. 15 wins & 45 nominations total,76,7.3,"375,347",tt1907668,"$93,772,375 "
237,Florence Foster Jenkins,2016,12-Aug-16,111 min,"Biography, Comedy, Drama",Stephen Frears,"Nicholas Martin, Julia Kogan","Meryl Streep, Hugh Grant, Simon Helberg","Florence Foster Jenkins, an heiress from NYC, always wanted to be a concert pianist and play Carnegie Hall. An injury in her youth deterred that dream, so she sets out to sing her way to Carnegie Hall, knowing the only way to get there would be, ""Practice, practice, practice"". Her husband supports her venture, and Florence Foster Jenkins' performance at Carnegie Hall becomes a truly historic event.","English, German, Italian, Russian","United Kingdom, France",Nominated for 2 Oscars. 10 wins & 48 nominations total,71,6.8,"59,416",tt4136084,"$27,383,770 "
238,"Food, Inc.",2008,31-Jul-09,94 min,"Documentary, News",Robert Kenner,"Robert Kenner, Elise Pearlstein, Kim Roberts","Michael Pollan, Eric Schlosser, Richard Lobb","The current method of raw food production is largely a response to the growth of the fast food industry since the 1950s. The production of food overall has more drastically changed since that time than the several thousand years prior. Controlled primarily by a handful of multinational corporations, the global food production business - with an emphasis on the business - has as its unwritten goals production of large quantities of food at low direct inputs (most often subsidized) resulting in enormous profits, which in turn results in greater control of the global supply of food sources within these few companies. Health and safety (of the food itself, of the animals produced themselves, of the workers on the assembly lines, and of the consumers actually eating the food) are often overlooked by the companies, and are often overlooked by government in an effort to provide cheap food regardless of these negative consequences. Many of the changes are based on advancements in science and technology, but often have negative side effects.The products made have been shown in several studies to enlarge male sexual organs and increase male breast size. The answer that the companies have come up with is to throw more science at the problems to bandage the issues but not the root causes. The global food supply may be in crisis with lack of biodiversity, but can be changed on the demand side of the equation.",English,United States,Nominated for 1 Oscar. 7 wins & 20 nominations total,80,7.8,"52,095",tt1286537,"$4,417,674 "
239,Footnote,2011,25-May-11,107 min,"Comedy, Drama",Joseph Cedar,Joseph Cedar,"Shlomo Bar-Aba, Lior Ashkenazi, Aliza Rosen","The story of a great rivalry between a father and son, both eccentric professors in the Talmud department of Hebrew University in Jerusalem. The son has an addictive dependency on the embrace and accolades that the establishment provides, while his father is a stubborn purist with a fear and profound revulsion for what the establishment stands for, yet beneath his contempt lies a desperate thirst for some kind of recognition. The Israel Prize, Israel's most prestigious national award, is the jewel that brings these two to a final, bitter confrontation.",Hebrew,Israel,Nominated for 1 Oscar. 14 wins & 9 nominations total,83,7.1,"6,274",tt1445520,"$2,007,758 "
240,For Sama,2019,26-Jul-19,100 min,"Documentary, Biography, War","Waad Al-Kateab, Edward Watts",N/A,"Waad Al-Kateab, Sama Al-Khateab, Hamza Al-Khateab","FOR SAMA is both an intimate and epic journey into the female experience of war. A love letter from a young mother to her daughter, the film tells the story of Waad al-Kateab's life through five years of the uprising in Aleppo, Syria as she falls in love, gets married and gives birth to Sama, all while cataclysmic conflict rises around her. Her camera captures incredible stories of loss, laughter and survival as Waad wrestles with an impossible choice - whether or not to flee the city to protect her daughter's life, when leaving means abandoning the struggle for freedom for which she has already sacrificed so much. The film is the first feature documentary by Emmy award-winning filmmakers Waad al-Kateab and Edward Watts.","Arabic, English","United Kingdom, Syria, United States",Nominated for 1 Oscar. 71 wins & 52 nominations total,89,8.5,"12,738",tt9617456,"$43,796 "
241,Ford v Ferrari,2019,15-Nov-19,152 min,"Action, Biography, Drama",James Mangold,"Jez Butterworth, John-Henry Butterworth, Jason Keller","Matt Damon, Christian Bale, Jon Bernthal","As Enzo Ferrari's fast Rosso-Corsa racing cars dominate the mid-1960s motorsport world, the American car designer, Carroll Shelby, is forced to retire after winning the demanding 1959 '24 Hours of Le Mans' endurance race. But, before long, an unexpected proposition by the Vice President of Henry Ford's motor company, Lee Iacocca, will offer an opportunity to beat the Italians at their own game. Now, under those pressing circumstances, the British sports car driver and racing engineer, Ken Miles, reluctantly agrees to lend a hand and improve the firm's image, as Ford's race team has less than ninety days to rewrite history. As a result, the non-conformist duo comes up with the mighty Ford GT40 Mk I high-performance racing car. Can Shelby and Miles break Ferrari's streak?","English, Italian, French, Japanese",United States,Won 2 Oscars. 26 wins & 88 nominations total,81,8.1,"465,051",tt1950186,"$117,624,357 "
242,Four Daughters,2023,5-Jul-23,107 min,Documentary,Kaouther Ben Hania,Kaouther Ben Hania,"Olfa Hamrouni, Eya Chikhaoui, Tayssir Chikhaoui","Between light and darkness stands Olfa, a Tunisian woman and the mother of four daughters. One day, her two older daughters disappear. Filmmaker Kaouther Ben Hania invites professional actresses to fill in their absence.","Arabic, French, English","France, Tunisia, Germany, Saudi Arabia, Cyprus",Nominated for 1 Oscar. 14 wins & 25 nominations total,78,7.5,"1,042",tt27502426,"$74,315 "
243,Foxcatcher,2014,16-Jan-15,134 min,"Biography, Drama, History",Bennett Miller,"E. Max Frye, Dan Futterman","Steve Carell, Channing Tatum, Mark Ruffalo","Based on true events, Foxcatcher tells the dark and fascinating story of the unlikely and ultimately tragic relationship between an eccentric multi-millionaire and two champion wrestlers. When Olympic Gold Medal winning wrestler Mark Schultz (Channing Tatum) is invited by wealthy heir John Du Pont (Steve Carell) to move on to the Du Pont estate and help form a team to train for the 1988 Seoul Olympics at his new state-of-the-art training facility, Schultz jumps at the opportunity, hoping to focus on his training and finally step out of the poverty stricken situation Olympic caliber athletes like he and his revered brother, Dave (Mark Ruffalo). Driven by hidden needs, Du Pont sees backing Schultz's bid for Gold and the chance to ""coach"" a world-class wrestling team as an opportunity to gain the elusive respect of his peers and, more importantly, his disapproving mother (Vanessa Redgrave). Trapped in Du Pont's majestic but suffocating world, Mark comes to see his benefactor as an egotistical, arrogant, and selfish megalomaniac and grows increasingly contemptuous. Though initially supportive, Du Pont's mercurial personality turns and he begins to lure Mark into an unhealthy lifestyle that threatens to undermine his training. Soon Du Pont's erratic behavior and threatening psychological game-play begin to erode the athlete's environment, stability, and motivation. Meanwhile Du Pont becomes fixated on Dave, who exudes the confidence Du Pont lacks. Du Pont eventually realizes he is unable to buy the respect he so desperately desires from the world's greatest wrestlers. Fueled by Du Pont's increasing paranoia and alienation from the brothers, the trio is propelled towards a tragedy no one could have foreseen.","English, French",United States,Nominated for 5 Oscars. 12 wins & 81 nominations total,81,7,"148,815",tt1100089,"$12,096,300 "
244,Frankenweenie,2012,5-Oct-12,87 min,"Animation, Comedy, Drama",Tim Burton,"Leonard Ripps, Tim Burton, John August","Winona Ryder, Catherine O'Hara, Martin Short","When young Victor's pet dog Sparky (who stars in Victor's home-made monster movies) is hit by a car, Victor decides to bring him back to life the only way he knows how. But when the bolt-necked ""monster"" wreaks havoc and terror in the hearts of Victor's neighbors, he has to convince them (and his parents) that despite his appearance, Sparky's still the good loyal friend he's always been.",English,"United States, United Kingdom",Nominated for 1 Oscar. 11 wins & 50 nominations total,74,6.9,"116,711",tt1142977,"$35,291,068 "
245,Free Guy,2021,13-Aug-21,115 min,"Action, Adventure, Comedy",Shawn Levy,"Matt Lieberman, Zak Penn","Ryan Reynolds, Jodie Comer, Taika Waititi","In the extremely popular video game, Free City, a NPC named Guy learns the true nature of his existence when he meets the girl of his dreams, a human player. This player's interactions with Guy has massive affects on him, the game, and real world as they play it.","English, Japanese, German","United States, Canada",Nominated for 1 Oscar. 5 wins & 29 nominations total,62,7.1,"422,935",tt6264654,"$121,626,598 "
246,Free Solo,2018,13-Dec-18,100 min,"Documentary, Adventure, Sport","Jimmy Chin, Elizabeth Chai Vasarhelyi",N/A,"Alex Honnold, Tommy Caldwell, Jimmy Chin","Alex Honnold faces the biggest challenge of his career, climbing El Capitan in Yosemite National Park. He pursues it Free Solo, which means climbing without a rope and alone.",English,United States,Won 1 Oscar. 31 wins & 54 nominations total,83,8.1,"76,996",tt7775622,"$17,541,090 "
247,French Roast,2009,19-Feb-10,8 min,"Animation, Short, Comedy",Fabrice Joubert,Fabrice Joubert,N/A,"A disheveled man picks up litter on a street using a stick with a nail on its end. In a bar, a cigar-smoking swell reads the financial section of a newspaper. The vagabond enters, the upstanding man ignores a request for alms, the hobo exits. The gent can't find his wallet, so he orders espresso after espresso as he ponders what to do. The vagabond returns, a napping nun at the next table gives him money, and the gent considers pilfering her purse. As the evening drags on, the bill for espresso mounts. A detective tacks up a wanted poster. Among the waiter, detective, nun, vagabond, and gent-in-a-jam, can luck or kindness find their way into the bar?",French,France,Nominated for 1 Oscar. 10 wins & 9 nominations total,N/A,7.1,"2,958",tt1323520,N/A
